title,author,price,publisher,page_count,generes,ISBN
Attack on Titan: Volume 13,Hajime Isayama,43.28,Kodansha Comics,192,"Comics , Graphic Novels , Superheroes",9781610000000 
Antiques Roadkill: A Trash 'n' Treasures Mystery,Barbara Allan,26.15,Kensington Publishing Corp.,288,"Fiction , Mystery , Detective , Cozy , General",9780760000000 
The Art of Super Mario Odyssey,Nintendo,133.85,Dark Horse Comics,368,"Games , Activities , Video , Electronic",9781510000000 
Getting Away Is Deadly: An Ellie Avery Mystery,Sara Rosett,26.15,Kensington Publishing Corp.,320,"Fiction , Fantasy , Epic",9781620000000 
"The Painted Man (The Demon Cycle, Book 1)",Peter V. Brett,28.54,HarperCollins UK,544,"Fiction , Fantasy , Dark Fantasy",9780010000000 
"A Feast for Crows (A Song of Ice and Fire, Book 4)",George R.R. Martin,29.29,HarperCollins UK,864,"Business , Economics , Motivational",9780010000000 
God of War: The Official Novelization,J.M. Barlog,15.82,Titan Books,400,"Fiction , Media Tie-In",9781790000000 
Edgedancer: From the Stormlight Archive,Brandon Sanderson,36.79,Tor Books,226,"Fiction , Fantasy , Epic",9781250000000 
"Blood, Sweat, and Pixels: The Triumphant, Turbulent Stories Behind How Video Games Are Made",Jason Schreier,50.25,HarperCollins,304,"Games , Activities , Video , Electronic",9780060000000 
Twas The Nightshift Before Christmas: Festive hospital diaries from the author of million-copy hit This is Going to Hurt,Adam Kay,41.82,Pan Macmillan,112,"Biography , Autobiography , Medical (incl. Patients)",9781530000000 
Sword of Destiny: Witcher 2: Tales of the Witcher,Andrzej Sapkowski,43.28,Hachette UK,400,"Fiction , Fantasy , Dragons , Mythical Creatures",9781470000000 
The Mysterious Affair at Styles (Poirot),Agatha Christie,19.28,HarperCollins UK,208,"Business , Economics , Motivational",9780010000000 
Riley Paige Mystery Bundle: Once Gone (#1) and Once Taken (#2),Blake Pierce,14.96,Blake Pierce,250,"Fiction , Science Fiction , Action , Adventure",9781630000000 
Deadpool Kills the Marvel Universe,Cullen Bunn,27.53,Marvel Entertainment,96,"Comics , Graphic Novels , Superheroes",9781300000000 
The Red Signal: An Agatha Christie Short Story,Agatha Christie,7.5,HarperCollins UK,40,"Fiction , Mystery , Detective , General",9780010000000 
Crossroads of Twilight: Book Ten of 'The Wheel of Time',Robert Jordan,33.42,Tor Fantasy,704,"Fiction , Fantasy , Epic",9781430000000 
Edgedancer: From the Stormlight Archive,Brandon Sanderson,36.79,Tor Books,226,"Fiction , Fantasy , Military",9781250000000 
Ultimate Spider-Man Vol. 11: Carnage,Brian Michael Bendis,43.28,Marvel Entertainment,144,"Fiction , Classics",9780790000000 
The Last Wife: An absolutely gripping and emotional page turner with a brilliant twist,Nicola Marsh,14.96,Bookouture,358,"Fiction , Women",9781840000000 
The Hitchhiker's Guide to the Galaxy: 42nd Anniversary Edition,Douglas Adams,32.51,Pan Macmillan,245,"Juvenile Fiction , Humorous Stories",9780330000000 
"Prince of Thorns (The Broken Empire, Book 1)",Mark Lawrence,24.94,HarperCollins UK,416,"Fiction , Classics",9780010000000 
Influence: The Psychology of Persuasion,Robert B. Cialdini,56.14,Harper Collins,336,"Business , Economics , Motivational",9780060000000 
Critical Role Vox Machina: Origins: Volume 1,Matthew Mercer,66.9,Dark Horse Comics,168,"Fiction , Mystery , Detective , Women Sleuths",9781510000000 
Introducing Critical Theory: A Graphic Guide,Stuart Sim,23.4,Icon Books,176,"Social Science , General",9781840000000 
Morning Star,Pierce Brown,62.1,Del Rey,544,"Fiction , Science Fiction , Action , Adventure",9780350000000 
Tall Tales and Wee Stories: The Best of Billy Connolly,Billy Connolly,98.42,Hachette UK,336,General,9781530000000 
After Anna,Alex Lake,20.51,HarperCollins UK,416,"Fiction , Mystery , Detective , General",9780010000000 
How to Win Friends and Influence People,Dale Carnegie,55.47,Random House,304,"Business , Economics , Motivational",9781410000000 
W is for Wasted: A Kinsey Millhone Novel,Sue Grafton,39.34,Penguin,448,"Fiction , Mystery , Detective , Women Sleuths",9781100000000 
Salvaged,Madeleine Roux,47.78,Penguin,368,"Fiction , Science Fiction , Action , Adventure",9780450000000 
The Art of Thinking Clearly,Rolf Dobelli,7.84,Harper Collins,384,General,9780060000000 
The Daylight War: Book Three of The Demon Cycle,Peter V. Brett,35.4,Del Rey,656,"Fiction , Fantasy , Epic",9780350000000 
The Ultimate Secrets of Total Self-Confidence,Robert Anthony,23.85,Penguin,240,General,9781100000000 
Ready Player One,Ernest Cline,39.34,Broadway Books,384,General,9780310000000 
A Forge of Valor (Kings and Sorcerers--Book 4),Morgan Rice,18.72,Morgan Rice,250,"Fiction , Fantasy , Epic",9781630000000 
How To Win Friends and Influence People,Dale Carnegie,51.15,Simon and Schuster,320,"Business , Economics , Leadership",9781450000000 
Introducing Critical Theory: A Graphic Guide,Stuart Sim,23.4,Icon Books,176,"Literary Criticism , General",9781840000000 
"Financial Statements, Revised and Expanded Edition: A Step-by-Step Guide to Understanding and Creating Financial Reports",Thomas Ittelson,78.73,Red Wheel/Weiser,288,"Business , Economics , Accounting , Financial",9781600000000 
Death of a Bachelorette,Laura Levine,29.9,Kensington Books,304,General,9781500000000 
Batman: The Man Who Laughs,Ed Brubaker,59.03,DC,146,General,9781400000000 
Martha Stewart's Cookie Perfection: 100+ Recipes to Take Your Sweet Treats to the Next Level: A Baking Book,Editors of Martha Stewart Living,66.87,Clarkson Potter,256,"Cooking , Methods , Baking",9781520000000 
The Last Wife: An absolutely gripping and emotional page turner with a brilliant twist,Nicola Marsh,14.96,Bookouture,358,General,9781840000000 
Twas The Nightshift Before Christmas: Festive hospital diaries from the author of million-copy hit This is Going to Hurt,Adam Kay,41.82,Pan Macmillan,112,"Literary Collections , Letters",9781530000000 
You'll Never See Daylight Again,Michaella McCollum,42.16,Kings Road Publishing,476,General,9781790000000 
The Raven,Edgar Allan Poe,0,Simon and Schuster,32,"Fiction , Literary",9781480000000 
Death of a Bachelorette,Laura Levine,29.9,Kensington Books,304,"Fiction , Mystery , Detective , Amateur Sleuth",9781500000000 
Little Girl Lost: A Lucy Black Thriller,Brian McGilloway,35.44,Harper Collins,336,"Fiction , Mystery , Detective , Women Sleuths",9780060000000 
I Am Pilgrim: The bestselling Richard & Judy Book Club pick,Terry Hayes,49.92,Random House,704,"Fiction , Thrillers , Suspense",9781450000000 
Civil War: Volume 1,Mark Millar,51.16,Marvel Entertainment,208,"Comics , Graphic Novels , Superheroes",9780790000000 
The Neatest Little Guide to Stock Market Investing: Fifth Edition,Jason Kelly,62.1,Penguin,336,General,9781100000000 
The Guardians: The explosive new thriller from international bestseller John Grisham,John Grisham,98.42,Hachette UK,384,"Fiction , Thrillers , Suspense",9781470000000 
"Blood, Sweat, and Pixels: The Triumphant, Turbulent Stories Behind How Video Games Are Made",Jason Schreier,50.25,HarperCollins,304,"Business , Economics , Industries , Computers , Information Technology",9780060000000 
After Anna,Alex Lake,20.51,HarperCollins UK,416,General,9780010000000 
The Art Of Seduction,Robert Greene,74.99,Profile Books,272,"Self-Help , Personal Growth , General",9781850000000 
Competitive Advantage: Creating and Sustaining Superior Performance,Michael E. Porter,78.72,Simon and Schuster,592,"Business , Economics , Industries , General",9781420000000 
Marketing (The Brian Tracy Success Library),Brian Tracy,29.4,AMACOM,112,"Business , Economics , Marketing , General",9780810000000 
Furies of Calderon,Jim Butcher,14.29,Penguin,672,General,9781440000000 
The Art Of Seduction,Robert Greene,74.99,Profile Books,272,"Family , Relationships , General",9781850000000 
The Fires of Heaven: Book Five of 'The Wheel of Time',Robert Jordan,33.42,Tor Books,704,"Fiction , Fantasy , Epic",9781430000000 
Secrets of the Millionaire Mind: Mastering the Inner Game of Wealth,T. Harv Eker,3.9,Harper Collins,224,"Business , Economics , Motivational",9780060000000 
"A Game of Thrones: The Story Continues Books 1-5: A Game of Thrones, A Clash of Kings, A Storm of Swords, A Feast for Crows, A Dance with Dragons (A Song of Ice and Fire)",George R.R. Martin,88.06,HarperCollins UK,4544,General,9780010000000 
A Game of Thrones: A Song of Ice and Fire: Book One,George R. R. Martin,39.34,Bantam,720,"Fiction , Fantasy , Epic",9780550000000 
A Game of Thrones: A Song of Ice and Fire: Book One,George R. R. Martin,39.34,Bantam,720,"Fiction , Science Fiction , Action , Adventure",9780550000000 
Happy: Why More or Less Everything is Absolutely Fine,Derren Brown,55.47,Random House,576,"Self-Help , Personal Growth , General",9781470000000 
The Memoirs of Sherlock Holmes,Arthur Conan Doyle,0,Simon and Schuster,320,"Fiction , Mystery , Detective , Private Investigators",9781480000000 
The Ultimate Secrets of Total Self-Confidence,Robert Anthony,23.85,Penguin,240,"Self-Help , Personal Growth , Self-Esteem",9781100000000 
Influence: The Psychology of Persuasion,Robert B. Cialdini,56.14,Harper Collins,336,General,9780060000000 
Bring Me Back,B A Paris,30.71,HarperCollins UK,368,"Fiction , Thrillers , Crime",9780010000000 
Good to Great: Why Some Companies Make the Leap...And Others Don't,Jim Collins,96.12,Harper Collins,320,"Business , Economics , Management",9780060000000 
How to Understand Business Finance: Edition 2,Bob Cinnamon,46.85,Kogan Page Publishers,176,"Business , Economics , Corporate Finance , General",9780750000000 
No Mercy: The brand new novel from the Queen of Crime,Martina Cole,98.42,Hachette UK,416,"Fiction , Crime",9781470000000 
The Weight of Honor (Kings and Sorcerers--Book 3),Morgan Rice,18.72,Morgan Rice,250,"Fiction , Science Fiction , General",9781630000000 
Crossroads of Twilight: Book Ten of 'The Wheel of Time',Robert Jordan,33.42,Tor Fantasy,704,General,9781430000000 
Batman: Year One,Frank Miller,59.03,DC,148,General,9781400000000 
How To Win Friends and Influence People,Dale Carnegie,51.15,Simon and Schuster,320,"Psychology , Interpersonal Relations",9781450000000 
Final Option: 'The best one yet',Clive Cussler,93.75,Penguin UK,400,"Fiction , Crime",9781410000000 
Heart and Brain: An Awkward Yeti Collection,The Awkward Yeti,33.14,Andrews McMeel Publishing,144,General,9781450000000 
Thirty-Five and a Half Conspiracies: Rose Gardner Mystery #8,Denise Grover Swank,15.19,DGS,350,General,9781940000000 
Rework,Jason Fried,71.63,Currency,288,"Business , Economics , Personal Success",9780310000000 
The Red Signal: An Agatha Christie Short Story,Agatha Christie,7.5,HarperCollins UK,40,"Fiction , Mystery , Detective , Hard-Boiled",9780010000000 
Dark Nights: Metal: Deluxe Edition: Issues 1-6,Scott Snyder,118.11,DC Comics,216,General,9781400000000 
How To Win Friends and Influence People,Dale Carnegie,51.15,Simon and Schuster,320,"Self-Help , Communication , Social Skills",9781450000000 
The Memoirs of Sherlock Holmes,Sir Arthur Conan Doyle,2.73,Courier Corporation,208,General,9780490000000 
"Shadowbred: The Twilight War, Book 1",Paul S. Kemp,27.53,Wizards of the Coast,352,"Fiction , Fantasy , Epic",9780790000000 
Permanent Record,Edward Snowden,49.58,Metropolitan Books,352,General,9781250000000 
The Marine's E-Mail Order Bride: Heroes of Chance Creek Volume 4,Cora Seton,15.72,One Acre Press,300,General,9781930000000 
Morning Star,Pierce Brown,62.1,Del Rey,544,General,9780350000000 
Now or Never: A Novel,Elizabeth Adler,31.46,Island Books,448,"Fiction , Mystery , Detective , Police Procedural",9780310000000 
Battle Sight Zero,Gerald Seymour,94.48,Hachette UK,448,"Fiction , Thrillers , Suspense",9781470000000 
Shattered Bonds,Faith Hunter,31.46,Penguin,400,"Fiction , Fantasy , Contemporary",9780400000000 
"Prince of Thorns (The Broken Empire, Book 1)",Mark Lawrence,24.94,HarperCollins UK,416,General,9780010000000 
"Rogue, Prisoner, Princess (Of Crowns and GloryBook 2)",Morgan Rice,14.96,Morgan Rice,250,General,9781630000000 
The Red Signal: An Agatha Christie Short Story,Agatha Christie,7.5,HarperCollins UK,40,"Fiction , Mystery , Detective , Cozy , General",9780010000000 
"Rogue, Prisoner, Princess (Of Crowns and GloryBook 2)",Morgan Rice,14.96,Morgan Rice,250,"Juvenile Fiction , Fantasy , Magic",9781630000000 
Predictably Irrational: The Hidden Forces that Shape Our Decisions,Dan Ariely,29.21,HarperCollins UK,304,General,9780010000000 
Twas The Nightshift Before Christmas: Festive hospital diaries from the author of million-copy hit This is Going to Hurt,Adam Kay,41.82,Pan Macmillan,112,General,9781530000000 
Death Masks,Jim Butcher,39.34,Penguin Group,464,General,9781100000000 
"The Power of Focus: How to Hit Your Business, Personal and Financial Targets with Confidence and Certainty",Jack Canfield,72.16,Random House,368,"Business , Economics , Personal Finance , General",9781450000000 
Think Like a Freak: The Authors of Freakonomics Offer to Retrain Your Brain,Steven D. Levitt,50.25,Harper Collins,304,General,9780060000000 
The Choice of Magic,Michael G. Manning,11.78,Michael Manning,408,General,9781940000000 
"The Complete Works of William Shakespeare: All 213 Plays, Poems, Sonnets, Apocryphal Plays + The Biography: The Life of William Shakespeare by Sidney Lee: Hamlet - Romeo and Juliet - King Lear - A Midsummer Night's Dream - Macbeth - The Tempest - Othello and many more",William Shakespeare,4.17,e-artnow,1424,"Drama , Shakespeare",9788030000000 
W is for Wasted: A Kinsey Millhone Novel,Sue Grafton,39.34,Penguin,448,General,9781100000000 
Auberon,James S. A. Corey,11.78,Hachette UK,112,General,9780360000000 
"Assassin's Apprentice (The Farseer Trilogy, Book 1)",Robin Hobb,26.51,HarperCollins UK,400,"Fiction , Fantasy , Dragons , Mythical Creatures",9780010000000 
"Captain Marvel Vol. 1: Higher, Further, Faster, More",Kelly Sue Deconnick,70.85,Marvel Entertainment,136,"Comics , Graphic Novels , Superheroes",9781300000000 
"The Name of the Wind: The Kingkiller Chronicle:, Book 1",Patrick Rothfuss,51.16,Hachette UK,672,"Fiction , Fantasy , Urban",9780580000000 
Captivate: The Science of Succeeding with People,Vanessa Van Edwards,66.87,Penguin,288,"Self-Help , Communication , Social Skills",9780400000000 
The Malady and Other Stories: An Andrzej Sapkowski Sampler,Andrzej Sapkowski,3.9,Hachette UK,96,General,9781470000000 
Kings and Sorcerers Bundle (Books 2 and 3),Morgan Rice,33.72,Morgan Rice,500,General,9781630000000 
Tall Tales and Wee Stories: The Best of Billy Connolly,Billy Connolly,98.42,Hachette UK,336,"Humor , General",9781530000000 
"Eat That Frog!: 21 Great Ways to Stop Procrastinating and Get More Done in Less Time, Edition 3",Brian Tracy,62.82,Berrett-Koehler Publishers,144,General,9781630000000 
Antiques Con,Barbara Allan,29.9,Kensington Books,288,"Fiction , Mystery , Detective , Amateur Sleuth",9781620000000 
The Art Of Seduction,Robert Greene,74.99,Profile Books,272,General,9781850000000 
Maigret Goes to School,Georges Simenon,47.78,Penguin,176,"Fiction , Thrillers , Suspense",9781520000000 
"The Name of the Wind: The Kingkiller Chronicle:, Book 1",Patrick Rothfuss,51.16,Hachette UK,672,"Fiction , Fantasy , Epic",9780580000000 
A Trace of Vice (a Keri Locke Mystery--Book #3),Blake Pierce,18.72,Blake Pierce,250,General,9781640000000 
Antiques Chop,Barbara Allan,29.9,Kensington Books,240,"Fiction , Mystery , Detective , Private Investigators",9781620000000 
"Goals!: How to Get Everything You Want -- Faster Than You Ever Thought Possible, Edition 2",Brian Tracy,86.45,Berrett-Koehler Publishers,288,General,9781610000000 
Principles: Life and Work,Ray Dalio,59.03,Simon and Schuster,592,"Business , Economics , General",9781500000000 
Antiques Roadkill: A Trash 'n' Treasures Mystery,Barbara Allan,26.15,Kensington Publishing Corp.,288,General,9780760000000 
Ask A Footballer,James Milner,98.42,Hachette UK,320,"Sports , Recreation , Soccer",9781530000000 
Young Justice Vol. 1,Art Baltazar,39.34,DC,164,"Comics , Graphic Novels , Superheroes",9781400000000 
The Weight of Honor (Kings and Sorcerers--Book 3),Morgan Rice,18.72,Morgan Rice,250,"Juvenile Fiction , Fantasy , Magic",9781630000000 
10 Ways to be less consumerist,James Fries,4.43,EDITORA BIBLIOMUNDI SERVIÇOS DIGITAIS LTDA,15,General,9781530000000 
'Salem's Lot,Stephen King,55.1,Hachette UK,300,"Fiction , Thrillers , Supernatural",9781850000000 
Bring Me Back,B A Paris,30.71,HarperCollins UK,368,"Fiction , Mystery , Detective , International Mystery , Crime",9780010000000 
Management (The Brian Tracy Success Library),Brian Tracy,38.44,AMACOM,112,General,9780810000000 
Little Girl Lost: A Lucy Black Thriller,Brian McGilloway,35.44,Harper Collins,336,"Fiction , Thrillers , Suspense",9780060000000 
Strawberry Shortcake Murder,Joanne Fluke,43.36,Kensington Books,304,General,9781620000000 
Batman and Robin Vol. 1: Batman Reborn,Grant Morrison,59.03,DC,172,General,9781400000000 
Killer Blonde,Laura Levine,73.67,Kensington Books,288,"Fiction , Mystery , Detective , Amateur Sleuth",9780760000000 
The Black Box,Michael Connelly,43.28,Hachette UK,448,General,9781410000000 
Management (The Brian Tracy Success Library),Brian Tracy,38.44,AMACOM,112,"Business , Economics , General",9780810000000 
Legacy,Shannon Messenger,43.28,Simon and Schuster,816,"Juvenile Fiction , Fantasy , Magic",9781530000000 
Gangster: A Novel,Lorenzo Carcaterra,31.46,Ballantine Books,384,"Fiction , Mystery , Detective , Hard-Boiled",9780350000000 
"The Name of the Wind: The Kingkiller Chronicle:, Book 1",Patrick Rothfuss,51.16,Hachette UK,672,General,9780580000000 
A Forge of Valor (Kings and Sorcerers--Book 4),Morgan Rice,18.72,Morgan Rice,250,"Fiction , Science Fiction , General",9781630000000 
Final Option: 'The best one yet',Clive Cussler,93.75,Penguin UK,400,"Fiction , Thrillers , Suspense",9781410000000 
Kings and Sorcerers Bundle (Books 2 and 3),Morgan Rice,33.72,Morgan Rice,500,"Juvenile Fiction , Fantasy , Magic",9781630000000 
Getting Away Is Deadly: An Ellie Avery Mystery,Sara Rosett,26.15,Kensington Publishing Corp.,320,"Fiction , Mystery , Detective , Cozy , General",9781620000000 
On Tyranny: Twenty Lessons from the Twentieth Century,Timothy Snyder,33.38,Tim Duggan Books,128,"History , Modern , 20th Century",9780800000000 
No Mercy: The brand new novel from the Queen of Crime,Martina Cole,98.42,Hachette UK,416,"Fiction , Thrillers , Domestic",9781470000000 
A Crown of Swords: Book Seven of 'The Wheel of Time',Robert Jordan,33.42,Macmillan,688,General,9781430000000 
The Hitchhiker's Guide to the Galaxy: 42nd Anniversary Edition,Douglas Adams,32.51,Pan Macmillan,245,"Fiction , Humorous , General",9780330000000 
Antiques Knock-Off,Barbara Allan,73.67,Kensington Publishing Corp.,240,"Fiction , Mystery , Detective , Cozy , General",9780760000000 
Thrawn (Star Wars),Timothy Zahn,39.34,Del Rey,448,"Fiction , Action , Adventure",9780350000000 
The Joker,Brian Azzarello,78.73,DC,130,General,9781400000000 
The Hitchhiker's Guide to the Galaxy: 42nd Anniversary Edition,Douglas Adams,32.51,Pan Macmillan,245,"Fiction , General",9780330000000 
Platform: Get Noticed in a Noisy World,Michael Hyatt,73.92,HarperCollins Leadership,288,General,9781600000000 
The Guardians: A Novel,John Grisham,71.63,Doubleday,384,"Fiction , Thrillers , Suspense",9780390000000 
Shantaram,Gregory David Roberts,55.1,Hachette UK,944,General,9781410000000 
The Burning White: Book Five of Lightbringer,Brent Weeks,98.42,Hachette UK,640,"Fiction , Fantasy , General",9780360000000 
Dead Silent,Shirley Wells,8.85,Harlequin,355,General,9781430000000 
Platform Revolution: How Networked Markets Are Transforming the Economy—and How to Make Them Work for You,Geoffrey G. Parker,70.7,W. W. Norton & Company,256,"Business , Economics , New Business Enterprises",9780390000000 
The Man in the High Castle,Philip K. Dick,55.17,Houghton Mifflin Harcourt,272,General,9780550000000 
Total Control,David Baldacci,41.82,Pan Macmillan,624,"Fiction , Mystery , Detective , General",9780330000000 
Antiques Knock-Off,Barbara Allan,73.67,Kensington Publishing Corp.,240,"Fiction , Mystery , Detective , Amateur Sleuth",9780760000000 
"The Name of the Wind: The Kingkiller Chronicle:, Book 1",Patrick Rothfuss,51.16,Hachette UK,672,"Fiction , Fantasy , General",9780580000000 
Shall We Tell the President?,Jeffrey Archer,41.82,Pan Macmillan,200,General,9780330000000 
The Tower of the Swallow: Witcher 6,Andrzej Sapkowski,43.28,Hachette UK,400,General,9781470000000 
"Rogue, Prisoner, Princess (Of Crowns and GloryBook 2)",Morgan Rice,14.96,Morgan Rice,250,"Juvenile Fiction , Science Fiction",9781630000000 
Wrecking Ball (Diary of a Wimpy Kid Book 14),Jeff Kinney,53.11,Abrams,224,General,9781680000000 
Auberon,James S. A. Corey,11.78,Hachette UK,112,"Fiction , Science Fiction , Action , Adventure",9780360000000 
Watching (The Making of Riley PaigeBook 1),Blake Pierce,0,Blake Pierce,250,"Fiction , Mystery , Detective , General",9781640000000 
The Mysterious Affair at Styles (Poirot),Agatha Christie,19.28,HarperCollins UK,208,"Fiction , Mystery , Detective , Cozy , General",9780010000000 
15 Delicious Slow Cooker Recipes,Sallie Stone,0,BookRix,18,General,9783740000000 
Little Girl Lost: A Lucy Black Thriller,Brian McGilloway,35.44,Harper Collins,336,"Fiction , Mystery , Detective , Police Procedural",9780060000000 
"The Complete Works of William Shakespeare: All 213 Plays, Poems, Sonnets, Apocryphal Plays + The Biography: The Life of William Shakespeare by Sidney Lee: Hamlet - Romeo and Juliet - King Lear - A Midsummer Night's Dream - Macbeth - The Tempest - Othello and many more",William Shakespeare,4.17,e-artnow,1424,"Poetry , General",9788030000000 
Dark Age,Pierce Brown,71.63,Del Rey,800,General,9780430000000 
Happy: Why More or Less Everything is Absolutely Fine,Derren Brown,55.47,Random House,576,"Self-Help , Self-Management , General",9781470000000 
Marvel Universe Vs. The Punisher: Volume 1,Jonathan Maberry,27.53,Marvel Entertainment,112,General,9780790000000 
It,Stephen King,19.65,Simon and Schuster,1168,"Fiction , Horror",9781500000000 
War and Peace: With bonus material from Give War and Peace A Chance by Andrew D. Kaufman,Leo Tolstoy,0,Simon and Schuster,1400,"Fiction , General",9781480000000 
A Trace of Vice (a Keri Locke Mystery--Book #3),Blake Pierce,18.72,Blake Pierce,250,"Fiction , Thrillers , Suspense",9781640000000 
The Memoirs of Sherlock Holmes,Arthur Conan Doyle,0,Simon and Schuster,320,General,9781480000000 
Find Me: A Novel,Andre Aciman,46.88,"Farrar, Straus and Giroux",272,"Fiction , LGBT , Gay",9780370000000 
Dark Matter: A Novel,Blake Crouch,28.61,Broadway Books,368,"Fiction , Thrillers , Suspense",9781100000000 
Happy: Why More or Less Everything is Absolutely Fine,Derren Brown,55.47,Random House,576,"Self-Help , Emotions",9781470000000 
"Shadowbred: The Twilight War, Book 1",Paul S. Kemp,27.53,Wizards of the Coast,352,General,9780790000000 
Strawberry Shortcake Murder,Joanne Fluke,43.36,Kensington Books,304,"Fiction , Mystery , Detective , Amateur Sleuth",9781620000000 
Spider-Man: Anti-Venom,Dan Slott,19.65,Marvel Entertainment,96,General,9780790000000 
Battle Sight Zero,Gerald Seymour,94.48,Hachette UK,448,General,9781470000000 
The Neatest Little Guide to Stock Market Investing: Fifth Edition,Jason Kelly,62.1,Penguin,336,"Business , Economics , Reference",9781100000000 
Kingdom Of Strangers,Zoe Ferraris,39.34,Hachette UK,368,General,9780750000000 
On Tyranny: Twenty Lessons from the Twentieth Century,Timothy Snyder,33.38,Tim Duggan Books,128,General,9780800000000 
In Dark Company: A Kate Burkholder Short Story,Linda Castillo,6.64,Minotaur Books,60,General,9781250000000 
The Infinite Game,Simon Sinek,71.63,Penguin,272,"Business , Economics , Motivational",9780740000000 
Freakonomics Rev Ed: A Rogue Economist Explores the Hidden Side of Everything,Steven D. Levitt,88.69,Harper Collins,336,"Business , Economics , Economics , Theory",9780060000000 
Killer Blonde,Laura Levine,73.67,Kensington Books,288,"Fiction , Mystery , Detective , Cozy , General",9780760000000 
Total Control,David Baldacci,41.82,Pan Macmillan,624,"Fiction , Thrillers , Suspense",9780330000000 
Little Girl Lost: A Lucy Black Thriller,Brian McGilloway,35.44,Harper Collins,336,General,9780060000000 
Kiss the Girls and Make Them Cry,Mary Higgins Clark,42.26,Simon and Schuster,400,General,9781470000000 
"Awaken the Giant Within: How to Take Immediate Control of Your Mental, Emotional, Physical and Financial",Tony Robbins,55.09,Simon and Schuster,544,"Self-Help , Personal Growth , Success",9780740000000 
The Eye of the World: Book One of 'The Wheel of Time',Robert Jordan,36.79,Tor Books,688,General,9781430000000 
"Goals!: How to Get Everything You Want -- Faster Than You Ever Thought Possible, Edition 2",Brian Tracy,86.45,Berrett-Koehler Publishers,288,"Self-Help , Personal Growth , Success",9781610000000 
15 Delicious Slow Cooker Recipes,Sallie Stone,0,BookRix,18,"Cooking , General",9783740000000 
Selling 101: What Every Successful Sales Professional Needs to Know,Zig Ziglar,29.55,HarperCollins Leadership,112,General,9781420000000 
Legacy,Shannon Messenger,43.28,Simon and Schuster,816,General,9781530000000 
Letting Go,David R. Hawkins,74.78,"Hay House, Inc",176,General,9781400000000 
10 Ways to be annoying,James Fries,4.43,EDITORA BIBLIOMUNDI SERVIÇOS DIGITAIS LTDA,17,General,9781530000000 
Shall We Tell the President?,Jeffrey Archer,41.82,Pan Macmillan,200,"Fiction , General",9780330000000 
The Guardians: A Novel,John Grisham,71.63,Doubleday,384,"Fiction , Thrillers , Crime",9780390000000 
Final Option,Clive Cussler,71.63,Penguin,400,"Fiction , Thrillers , Suspense",9780530000000 
Rogues,George R. R. Martin,52.54,Bantam,832,General,9780800000000 
The Power of Habit: Why We Do What We Do in Life and Business,Charles Duhigg,62.1,Random House,416,"Business , Economics , Organizational Behavior",9780680000000 
